id_video,fecha_recuperacion,nombre_usuario,url_perfil,comentario,fecha_publicacion,num_likes,producto,red_social,sentimiento
7436804325088988462,2024-12-02 20:33:18.813823,Dani,https://www.tiktok.com/@daniela_rp,What is the font ?,11-15,0,goodnotes,tiktok,NEU
7436804325088988462,2024-12-02 20:33:18.822411,JasThaGoddess✨,https://www.tiktok.com/@jasthagoddess,Back to Goodnotes I go. Lol I been hooked on Notes+ lately,11-13,5,goodnotes,tiktok,NEU
7436804325088988462,2024-12-02 20:33:18.833407,Janette Waters Ekanger,https://www.tiktok.com/@janettewatersekanger,Is that tool still available on goodnotes? I can seem two get it.,11-19,0,goodnotes,tiktok,NEU
7436804325088988462,2024-12-02 20:33:18.841752,Alea Haliti 🎀,https://www.tiktok.com/@aleaa_halitii,App name,Hace 5 día(s),0,goodnotes,tiktok,NEU
7436804325088988462,2024-12-02 20:33:18.852750,Almuallim,https://www.tiktok.com/@hatim.essa,Font name,11-17,0,goodnotes,tiktok,NEU
7436804325088988462,2024-12-02 20:33:18.862106,hohola,https://www.tiktok.com/@nananini.beo,where u get this casing?,Hace 6 día(s),1,goodnotes,tiktok,NEU
7436804325088988462,2024-12-02 20:33:18.870965,Gya,https://www.tiktok.com/@gya1935,😳thx u i still learning it’s so much amazing stuff🥰🥰,11-14,2,goodnotes,tiktok,NEU
7436804325088988462,2024-12-02 20:33:18.878965,Design Coach,https://www.tiktok.com/@sultriaccessori,I just love the color brown,11-13,1,goodnotes,tiktok,POS
7436804325088988462,2024-12-02 20:33:18.888155,Goodnotes App,https://www.tiktok.com/@goodnotes,💙💙💙,Hace 4 día(s),0,goodnotes,tiktok,NEU
6958268890317114630,2024-12-02 20:34:04.536838,</3,https://www.tiktok.com/@luvley.ri_,oye con cuál de todas las aplicaciones de goodnotes,2021-5-23,3,goodnotes,tiktok,NEU
6958268890317114630,2024-12-02 20:34:04.547838,Anyer Atrebor,https://www.tiktok.com/@anyerg1,"Excelente idea, para cuidar nuestro planeta 🌎",2021-5-4,6,goodnotes,tiktok,POS
6958268890317114630,2024-12-02 20:34:04.557838,gatitogalacticoo,https://www.tiktok.com/@gatitogalacticoo,Podrías hacer una demostración en computadora?😊😊,2021-7-27,6,goodnotes,tiktok,NEU
6958268890317114630,2024-12-02 20:34:04.567515,s ᴀ ʀ ᴀ ʏ_ ᴊ ᴜ ʟ ɪ ᴀ ɴ ᴀ,https://www.tiktok.com/@saray_1430,como puedes hacer tus apuntes por el celular,2021-5-24,5,goodnotes,tiktok,NEG
6958268890317114630,2024-12-02 20:34:04.576510,𝓨𝓮𝓮𝔂 ❕,https://www.tiktok.com/@gonzalez_yeey,cómo la busco en celular,2021-8-3,1,goodnotes,tiktok,NEU
6958268890317114630,2024-12-02 20:34:04.585585,wuz.maia,https://www.tiktok.com/@wuz.maia,cómo se llama la aplicación,2021-7-27,1,goodnotes,tiktok,NEU
6958268890317114630,2024-12-02 20:34:04.594584,Curo Milagros,https://www.tiktok.com/@curomilagros,😳😳😳,11-7,0,goodnotes,tiktok,NEU
6958268890317114630,2024-12-02 20:34:04.603256,Nadian R.V,https://www.tiktok.com/@nadian.r.v,😂😂😂,10-26,0,goodnotes,tiktok,NEU
7277008787846761734,2024-12-02 20:34:25.347879,Fernanda Rojano,https://www.tiktok.com/@fernandarojano02,"Una alternativa muy buena es Notability, me gusta más que Good Notes",2023-11-19,362,goodnotes,tiktok,POS
7277008787846761734,2024-12-02 20:34:25.357879,🤍Liseiva🤍,https://www.tiktok.com/@vania_lisset,se necesita pagar pata utilizar goodnotes?,2023-9-14,137,goodnotes,tiktok,NEU
7277008787846761734,2024-12-02 20:34:25.367888,Ks Lima,https://www.tiktok.com/@katesolange,Si tienes buen estilo con iPad,2023-10-3,0,goodnotes,tiktok,POS
7277008787846761734,2024-12-02 20:34:25.377879,Leylaa Mora Salas,https://www.tiktok.com/@leylamorasalas,Que iPad me recomiendan?🥹,2023-10-2,35,goodnotes,tiktok,NEU
7277008787846761734,2024-12-02 20:34:25.386877,sofi,https://www.tiktok.com/@sofiaamartinaa,es gratis la app?💘,2023-10-2,7,goodnotes,tiktok,NEU
7277008787846761734,2024-12-02 20:34:25.397875,Ñiñotaaaa💗🇩🇴,https://www.tiktok.com/@soy_manuela01,Cual es mejor iPad 5 generación o 10,2023-11-12,1,goodnotes,tiktok,NEU
7277008787846761734,2024-12-02 20:34:25.408881,Anndy03,https://www.tiktok.com/@andy_rdzj,Good notes se paga cada mes?,2023-11-2,7,goodnotes,tiktok,NEU
7277008787846761734,2024-12-02 20:34:25.417876,Lolita Mua,https://www.tiktok.com/@lolitamua_,Debe ser con el apple pencil original?,4-10,0,goodnotes,tiktok,NEU
7277008787846761734,2024-12-02 20:34:25.428879,⋆ ࣪. 𓄼 Jh,https://www.tiktok.com/@jhumphoria,Cuál es el ipad qué usas? 🥰,2023-9-11,14,goodnotes,tiktok,NEU
7277008787846761734,2024-12-02 20:34:25.437876,thisha,https://www.tiktok.com/@thishanice,pero es mucho tiempo hacer eso y hay que hacer tareas,2023-9-14,6,goodnotes,tiktok,NEG
7277008787846761734,2024-12-02 20:34:25.449877,Carla Perez,https://www.tiktok.com/@swaggonyou,Que iPad recomiendas ? El de 10 generación es bueno ?,2023-9-10,1,goodnotes,tiktok,NEU
7277008787846761734,2024-12-02 20:34:25.458877,bonejordy,https://www.tiktok.com/@bonejordy,son pagada la aplicación o son gratuitas,2023-9-29,0,goodnotes,tiktok,NEU
7277008787846761734,2024-12-02 20:34:25.467878,montesaba,https://www.tiktok.com/@brisgmb,Necesita internet,2023-11-10,0,goodnotes,tiktok,NEU
7277008787846761734,2024-12-02 20:34:25.479879,z z 𐰁 ˋ ★ ˎˊ˗,https://www.tiktok.com/@lorenacazani,que marca es tu ¡Pad ?,2023-11-25,1,goodnotes,tiktok,NEU
7277008787846761734,2024-12-02 20:34:25.490877,Fat,https://www.tiktok.com/@fatypayne,Cómo instalaste esas fuentes?? 🥺,2023-9-17,34,goodnotes,tiktok,NEU
7277008787846761734,2024-12-02 20:34:25.500876,cesars1687,https://www.tiktok.com/@cesars1687,En una. Air 4ta generación funciona esa app?,2023-9-14,1,goodnotes,tiktok,NEU
7277008787846761734,2024-12-02 20:34:25.510875,@verovik,https://www.tiktok.com/@verovikk,Intento t juro pero nunca me sale,2023-9-13,0,goodnotes,tiktok,NEG
7277008787846761734,2024-12-02 20:34:25.520875,Playdo,https://www.tiktok.com/@playingwithflowers,Alguien sabe de alguna aplicación en la que no se tenga que pagar???,2023-9-15,19,goodnotes,tiktok,NEU
7277008787846761734,2024-12-02 20:34:25.529876,María Fernanda,https://www.tiktok.com/@mariafernholguin,y cuanto cuesta uno ?,2023-9-15,1,goodnotes,tiktok,NEU
7277008787846761734,2024-12-02 20:34:25.539882,M,https://www.tiktok.com/@dreameraki16,Que ipad es?,7-6,0,goodnotes,tiktok,NEU
7277008787846761734,2024-12-02 20:34:54.260402,Rafita,https://www.tiktok.com/@xraffx4,Si tengo iPad Pro que app me recomienda para dividir la pantalla?,1-26,0,goodnotes,tiktok,NEU
7277008787846761734,2024-12-02 20:34:54.269638,nachoo,https://www.tiktok.com/@http_ignacio123,porque es necesario hacer apuntes ? porque por lo que tengo entendido es solo tema estudiar examen pa que apuntes ?,2023-11-17,1,goodnotes,tiktok,NEG
7277008787846761734,2024-12-02 20:34:54.278640,Normand_mx,https://www.tiktok.com/@normand_mx,"El sábado llega la mía, ya tengo el pencil 🥰",2023-9-22,2,goodnotes,tiktok,POS
7277008787846761734,2024-12-02 20:34:54.287225,David Narvàez,https://www.tiktok.com/@whosdavid03,Que teclado usas para el IPad?,2023-9-14,33,goodnotes,tiktok,NEU
7277008787846761734,2024-12-02 20:34:54.296118,S☆<3,https://www.tiktok.com/@s383688,Cual es la ipad y el lápiz blanco ese q usa lo quiero Comprar,3-22,0,goodnotes,tiktok,NEU
7277008787846761734,2024-12-02 20:34:54.305106,☁️darien☁️ (José's version),https://www.tiktok.com/@happytomerntt,arriba me salio el video de alguien que subio que compro un ipad para hacer apuntes y no le salio bien y me saliste tu ahora jsjsjs,2023-11-12,15,goodnotes,tiktok,NEG
7277008787846761734,2024-12-02 20:34:54.321228,𝖌𝖚𝖝𝖝𝖎,https://www.tiktok.com/@guxxitf,porqué todos los vídeos e imágenes que veo de apuntes siempre son de medicina o algún tipo de ciencia🥲,2023-11-29,45,goodnotes,tiktok,NEG
7277008787846761734,2024-12-02 20:34:54.330330,GYLL💕🫧🧋,https://www.tiktok.com/@geilis90,Se puede usar la aplicación notas para iPad 😅??,2023-12-2,0,goodnotes,tiktok,NEU
7277008787846761734,2024-12-02 20:34:54.338469,Andres Camilo,https://www.tiktok.com/@andrecarm3108,que referencia tiene su ipad,2023-11-7,0,goodnotes,tiktok,NEU
7277008787846761734,2024-12-02 20:34:54.348832,Mikey,https://www.tiktok.com/@claverodcosta,que iPad es?,3-3,0,goodnotes,tiktok,NEU
7277008787846761734,2024-12-02 20:34:54.357516,nina,https://www.tiktok.com/@nina54849,"una pregunta en esa se puede descargar lo mismo que una computadora? cómo worl ,PDF y todo es para herramienta de trabajo",11-15,0,goodnotes,tiktok,NEU
7277008787846761734,2024-12-02 20:34:54.367552,J●$£l! t®,https://www.tiktok.com/@ppcomic,¿Funciona para ipad mina 4 generación? 😥,2023-11-5,0,goodnotes,tiktok,NEG
7277008787846761734,2024-12-02 20:34:54.375543,Zars,https://www.tiktok.com/@mira012_2,"Hola,hace poco compré una iPad y no tengo para comprar el Pencil y el teclado,me gustaría manejar los apuntes,pero también debo entregar trabajos escritos,crees que me sirva más primero el teclado?❤️",10-1,0,goodnotes,tiktok,NEU
7277008787846761734,2024-12-02 20:34:54.385547,andreacopt,https://www.tiktok.com/@andreacopt,"chicos ayuda, es recomendable tener un iPad para la carrera de ingeniería de sistemas?✨",2023-11-29,0,goodnotes,tiktok,NEU
7277008787846761734,2024-12-02 20:34:54.393751,Paulina,https://www.tiktok.com/@pauli_clerici31,se puede usar en otro dispositivo y por donde lo instalas,2-18,0,goodnotes,tiktok,NEU
7277008787846761734,2024-12-02 20:34:54.402840,nothing_important_here,https://www.tiktok.com/@mawiwi_05,Pero como hacen para que no se mueva mientras escribes?,7-24,0,goodnotes,tiktok,NEU
7277008787846761734,2024-12-02 20:34:54.411041,Sandra Lopez,https://www.tiktok.com/@sandra.lopez4881,se puede pegar la mano por el ipad cuando se escribe ¿?,8-8,0,goodnotes,tiktok,NEG
7277008787846761734,2024-12-02 20:34:54.421041,Kitikat789,https://www.tiktok.com/@kitikat_789,"Goodnote me encanta Pero tiene hojas limitadas, tienes quebpagar para poner mas carpetas u hojas 😭",6-11,0,goodnotes,tiktok,NEG
7277008787846761734,2024-12-02 20:34:54.430121,ana,https://www.tiktok.com/@ana.mm.5,a mí no me aparece good notes,8-7,0,goodnotes,tiktok,NEG
7277008787846761734,2024-12-02 20:34:54.439117,🏥.𝒟𝓇𝒶 𝒱𝒶𝓇𝑔𝒶𝓈 ..🩺,https://www.tiktok.com/@dravargasseveriche,una ayuda por favor,2023-11-29,0,goodnotes,tiktok,NEU
7277008787846761734,2024-12-02 20:35:15.900066,Kenny Cruz Revilla,https://www.tiktok.com/@_kenny.cruz,Cuánto dura la batería de tu iPad?,7-6,0,goodnotes,tiktok,NEU
7277008787846761734,2024-12-02 20:35:15.909083,Patty Erazo ✨,https://www.tiktok.com/@pattyerazo,Que tipografía usas? 😍,10-16,0,goodnotes,tiktok,POS
7277008787846761734,2024-12-02 20:35:15.918067,Vanessa Pinto,https://www.tiktok.com/@vanessapintot,Qué iPad es?,2023-9-10,0,goodnotes,tiktok,NEU
7277008787846761734,2024-12-02 20:35:15.928031,Julia,https://www.tiktok.com/@user6662803123,"una pregunta, cuando usan good notes no se le acaba la batería más rápido?",1-28,0,goodnotes,tiktok,NEG
7277008787846761734,2024-12-02 20:35:15.937031,Fatima Martinez,https://www.tiktok.com/@fatimamartinez1311,Se necesita tener internet siempre para usar la app?,2023-12-8,0,goodnotes,tiktok,NEU
7277008787846761734,2024-12-02 20:35:15.949672,keniaarrieta6,https://www.tiktok.com/@keniaarrieta6,No me gusta porque no es compatible,8-19,0,goodnotes,tiktok,NEG
7277008787846761734,2024-12-02 20:35:15.959690,Keniavmeza,https://www.tiktok.com/@kenianmeza_,De donde es tu funda con teclado? Podrias pasar el link,7-6,0,goodnotes,tiktok,NEU
7277008787846761734,2024-12-02 20:35:15.967673,Momo,https://www.tiktok.com/@momito2004,Que IPad tienes?,2023-12-3,0,goodnotes,tiktok,NEU
7277008787846761734,2024-12-02 20:35:15.977205,Joo Rodríguez,https://www.tiktok.com/@maritzajoo1,"Me gustaría saber q IPad usas, mi niña empezará la UNIVERSIDAD y m gustaría comprarle una.",2023-10-27,1,goodnotes,tiktok,NEU
7277008787846761734,2024-12-02 20:35:15.986204,Michelle🥹,https://www.tiktok.com/@amy0602michelle,una pregunta que iPad es,1-12,0,goodnotes,tiktok,NEU
7277008787846761734,2024-12-02 20:35:15.995828,Humbert,https://www.tiktok.com/@tor_whos,Que iPad tienes,2023-12-2,0,goodnotes,tiktok,NEU
7277008787846761734,2024-12-02 20:35:16.006152,muchacho🫶🏻,https://www.tiktok.com/@jarethzy2013,nombre de la iPad,7-18,0,goodnotes,tiktok,NEU
7277008787846761734,2024-12-02 20:35:16.015155,Xiomara Estrella,https://www.tiktok.com/@estr4lla_22,Ese iPad cuál es amiga ?,Hace 5 día(s),0,goodnotes,tiktok,NEU
7277008787846761734,2024-12-02 20:35:16.025166,Robert 🏌🏻,https://www.tiktok.com/@robertkgfo10,~ meta pura,3-18,0,goodnotes,tiktok,NEU
7277008787846761734,2024-12-02 20:35:16.033690,Martha,https://www.tiktok.com/@porcausadaamor,"Hola, cual es esa iPad.",2023-12-30,0,goodnotes,tiktok,NEU
7277008787846761734,2024-12-02 20:35:16.043760,Danoninodemango,https://www.tiktok.com/@fabiolaalvarez232,Quiero empezar a usar iPad cual me recomiendan?,2023-11-26,0,goodnotes,tiktok,NEU
7277008787846761734,2024-12-02 20:35:16.052217,génesis,https://www.tiktok.com/@gatafiera.a,holaaa tienes el link de la fuente happy memories? por favorrr😭,1-9,0,goodnotes,tiktok,NEU
7277008787846761734,2024-12-02 20:35:16.062688,Ximenapab,https://www.tiktok.com/@ximenapab28,Sabes por que en mi tablet Microsoft no me da la opción para añadir cien te s en mi texto? Maybe si la pago me saldrá? Es que me da miedo pagarla y que no me salga aún jajaja,8-31,0,goodnotes,tiktok,NEG
7277008787846761734,2024-12-02 20:35:16.071688,Claire Tephy,https://www.tiktok.com/@stephy.olivera,que iPad yaaa,2023-9-28,2,goodnotes,tiktok,NEU
7277008787846761734,2024-12-02 20:35:16.080067,Jazmín Avilés Ochoa,https://www.tiktok.com/@mina.san,que teclado usas?,2023-11-25,0,goodnotes,tiktok,NEU
7277008787846761734,2024-12-02 20:35:38.255169,Nayi,https://www.tiktok.com/@nxyiiicdt,Como pones la hoja horizontal,9-17,0,goodnotes,tiktok,NEU
7277008787846761734,2024-12-02 20:35:38.264166,Aleeee,https://www.tiktok.com/@alee_1311,Que protector tienes?,3-6,0,goodnotes,tiktok,NEU
7277008787846761734,2024-12-02 20:35:38.273537,ITZEL 🌊🐚🇲🇽,https://www.tiktok.com/@ww.tiktok.itzel_17,se puede instalar en cualquier tablet?,7-25,0,goodnotes,tiktok,NEU
7277008787846761734,2024-12-02 20:35:38.282576,zozo 🦇,https://www.tiktok.com/@__23zoee,*llora en Android*,2-20,0,goodnotes,tiktok,NEG
7277008787846761734,2024-12-02 20:35:38.292531,Eitan,https://www.tiktok.com/@xdxdd6081,samsung tab s9 ultra,2023-12-10,0,goodnotes,tiktok,NEU
7277008787846761734,2024-12-02 20:35:38.301532,Airi,https://www.tiktok.com/@soyglezz15,Y ahora que es de pago como lo haces?,3-6,0,goodnotes,tiktok,NEU
7277008787846761734,2024-12-02 20:35:38.310420,Mary Solorzano,https://www.tiktok.com/@19smary,para hacer en Word también trae,9-17,0,goodnotes,tiktok,NEU
7277008787846761734,2024-12-02 20:35:38.320409,Momento Matemático,https://www.tiktok.com/@momentomatematicoo,¿Hay alguna forma de ocultar la barra de herramientas de Goodnotes?,2023-9-11,1,goodnotes,tiktok,NEU
7277008787846761734,2024-12-02 20:35:38.329063,Mary(◍•ᴗ•◍)❤,https://www.tiktok.com/@ww_xx_mary,se puede en laptop?,3-10,0,goodnotes,tiktok,NEU
7277008787846761734,2024-12-02 20:35:38.341060,julieta.reyna1258,https://www.tiktok.com/@julieta.reyna1258,I😍,6-25,0,goodnotes,tiktok,POS
7277008787846761734,2024-12-02 20:35:38.351197,Gabriel Sosa,https://www.tiktok.com/@gafesomeoficial,Sube más videos de tus notas porfa 🥰,3-11,0,goodnotes,tiktok,POS
7277008787846761734,2024-12-02 20:35:38.360073,Jime Vanegas 🍃💌,https://www.tiktok.com/@vanegaaaas,"Está súper cute tu teclado, de dónde eeees? 💌",2023-9-10,2,goodnotes,tiktok,POS
7277008787846761734,2024-12-02 20:35:38.369073,Nicol Rec,https://www.tiktok.com/@nicrec,Gracias,8-27,0,goodnotes,tiktok,NEU
7277008787846761734,2024-12-02 20:35:38.385046,Ronald 🧣,https://www.tiktok.com/@ronaldcc77,otro día te vi en la cafetería de la uss no está seguro si eras :/,2023-9-10,2,goodnotes,tiktok,NEG
7277008787846761734,2024-12-02 20:35:38.393408,Isaac Hinojosa,https://www.tiktok.com/@isaachinojosa5,Esa plantilla donde la conseguiste?,2023-9-9,1,goodnotes,tiktok,NEU
7277008787846761734,2024-12-02 20:35:38.402943,Manu Galván,https://www.tiktok.com/@elpinshimanu,Como haces tablas? O solo con la herramienta de figuras geométricas? Y si si como le poner relleno al fondo? 🤔,2023-9-18,2,goodnotes,tiktok,NEU
7277008787846761734,2024-12-02 20:35:38.410942,Evelyn Jhulisa Quisp,https://www.tiktok.com/@evelyn_10_fl,Consulta que teclado usas,2023-9-11,1,goodnotes,tiktok,NEU
7277008787846761734,2024-12-02 20:35:38.420761,Citlalli,https://www.tiktok.com/@yakkolover,Que tamaño de papel usas?,2-21,1,goodnotes,tiktok,NEU
7277008787846761734,2024-12-02 20:35:38.429763,Zharick,https://www.tiktok.com/@liadragun,¿Cómo se hacen los sticker? :(,2023-10-21,1,goodnotes,tiktok,NEG
7277008787846761734,2024-12-02 20:35:38.439764,Beyra Gonzalez,https://www.tiktok.com/@beyragonzalez,✓,7-30,0,goodnotes,tiktok,POS
7393014561697271072,2024-12-02 20:36:34.050071,Mich,https://www.tiktok.com/@hamster_gordo3,Es solo para premium ?,11-8,0,goodnotes,tiktok,NEU
7393014561697271072,2024-12-02 20:36:34.060062,Dreth,https://www.tiktok.com/@dreth,woow 🫶,7-18,1,goodnotes,tiktok,POS
7393014561697271072,2024-12-02 20:36:34.070403,Pablo M. Trainer,https://www.tiktok.com/@morillastrainer,📝👍🏻,7-18,1,goodnotes,tiktok,NEU
7207842117652122886,2024-12-02 20:36:57.888695,Hannah,https://www.tiktok.com/@hannahvar97,"yo uso Samsung Notes, esta app es mejor?",2023-4-4,2,goodnotes,tiktok,NEU
7207842117652122886,2024-12-02 20:36:57.899031,Fiti_5000,https://www.tiktok.com/@fiti_5000,si tienes Samsung para que quieres eso teniendo Samsung notes?😂,2023-3-13,66,goodnotes,tiktok,NEG
7207842117652122886,2024-12-02 20:36:57.908031,Pablo Alexander Roja,https://www.tiktok.com/@pabloalexsupertramp,no está en Google play,2023-3-7,8,goodnotes,tiktok,NEU
7207842117652122886,2024-12-02 20:36:57.918228,It.valdo,https://www.tiktok.com/@it.valdo,Pues en playstore no aparece,2023-5-10,2,goodnotes,tiktok,NEG
7207842117652122886,2024-12-02 20:36:57.927891,caminante 😉,https://www.tiktok.com/@caminantetktk,y alguno que comparta notas en pc y celular para lo que trabajamos en ambas 👀,2023-3-11,1,goodnotes,tiktok,NEU
7207842117652122886,2024-12-02 20:36:57.940890,Andres,https://www.tiktok.com/@andresuelguz,No sale en la tienda 🤔,2023-3-7,0,goodnotes,tiktok,NEU
7207842117652122886,2024-12-02 20:36:57.950503,Christian,https://www.tiktok.com/@chris16hc,Que diferencia tiene con la aplicación nativa de notas que ya traen los android 🤔,2023-3-13,2,goodnotes,tiktok,NEU
7207842117652122886,2024-12-02 20:36:57.960498,ismaelrettodolori,https://www.tiktok.com/@ismaelrettodolorier,tengo un ZTE blade no me sale en playstore,9-21,0,goodnotes,tiktok,NEG
7207842117652122886,2024-12-02 20:36:57.971500,Sounds_of_life,https://www.tiktok.com/@marcode_7,Solo disponible para tabletas Samsung,2023-3-7,4,goodnotes,tiktok,NEU
7207842117652122886,2024-12-02 20:36:57.980949,luisngelaguirre,https://www.tiktok.com/@sr.luislibre,"eso ya lo tiene Samsung, nosé si alguien lo lanzó antes",2023-3-7,2,goodnotes,tiktok,NEU
7207842117652122886,2024-12-02 20:36:57.990970,MASTERSOFT488,https://www.tiktok.com/@mastersoft488ivan,😂samsung tiene la su app y huawei tambien,2023-3-8,2,goodnotes,tiktok,NEU
7207842117652122886,2024-12-02 20:36:57.999955,Reveka Chaketa,https://www.tiktok.com/@revekachaketa,la beta va con lag,2023-3-13,1,goodnotes,tiktok,NEG
7207842117652122886,2024-12-02 20:36:58.009293,Santiago Epia Roso,https://www.tiktok.com/@santiagoepia,"Si ya la compre en mi ipad, tendré qu3 comprarla de nuevo en Android?",2023-4-4,0,goodnotes,tiktok,NEU
7207842117652122886,2024-12-02 20:36:58.019089,alfrantos,https://www.tiktok.com/@alfrantos,Samsung Notes no tiene nada que envidiarle a Good Notes,2023-3-11,3,goodnotes,tiktok,POS
7403984179597151493,2024-12-02 22:25:31.370060,DavidZM99,https://www.tiktok.com/@davidzm99,la cosa esq obsidian no es multiplataforma no es decir si lo tengo en local en el pc para mirarlo en el móvil habia q pagar no?,8-17,21,obsidian,tiktok,NEG
7403984179597151493,2024-12-02 22:25:31.381555,Jaor Jaor,https://www.tiktok.com/@jaorjaor4,"Yo uso Notion, Pero Obsidian es brutal con ese Flow",8-17,4,obsidian,tiktok,NEU
7403984179597151493,2024-12-02 22:25:31.389613,CLUB SUCULENTAS PREMIUM,https://www.tiktok.com/@club.suculentas,"harás más videos sobre obsidian y zettelkasten? no encuentro mucho contenido en español sobre eso aquí en tik tok, la mayoría es de notion y gente que vende plantil",8-17,5,obsidian,tiktok,NEU
7403984179597151493,2024-12-02 22:25:31.398190,rickcavar,https://www.tiktok.com/@rickcavar,"yo estuve usando obsidian, que perdida de tiempo realmente, es vista grafica no era nada util, perdí tiempo y rendimiento, encima que debes sincronizar o sino no podras usarla nunca en otro dispositiv",10-14,0,obsidian,tiktok,NEG
7403984179597151493,2024-12-02 22:25:31.407188,Mike Villarreal,https://www.tiktok.com/@mikevill03,"no te pases,sin querer usaba algo parecido al método cornell en mi libreta cuando estaba en la escuela, no sabía que si había una metodologia propiamente.",8-17,3,obsidian,tiktok,NEG
7403984179597151493,2024-12-02 22:25:31.417665,Sidney,https://www.tiktok.com/@sidney_peru,es como tener una memoria de trabajo externa 💀,9-21,3,obsidian,tiktok,NEG
7403984179597151493,2024-12-02 22:25:31.428682,Daniel Díaz,https://www.tiktok.com/@dhanieldiaz,"estudio 2 licenciaturas, física y la otra es filosofía, que plataforma me recomiendas sobretodo para Física",8-17,11,obsidian,tiktok,NEU
7403984179597151493,2024-12-02 22:25:31.438066,Francisco Peraza,https://www.tiktok.com/@.chelito,"Sabes, no sé si te pasa, pero con Zettelkasten terminas ocupando demasiado tiempo en pensar como conectar las notas. No encontré una solución directa a esa problemática.",9-2,1,obsidian,tiktok,NEG
7403984179597151493,2024-12-02 22:25:31.446308,Anthony Meza,https://www.tiktok.com/@anthonymz23,podrías hacer un vídeo explicando un poco mejor como funciona?,8-29,0,obsidian,tiktok,NEU
7403984179597151493,2024-12-02 22:25:31.455310,sopimmm,https://www.tiktok.com/@sopimmm,👌👌👌,10-14,1,obsidian,tiktok,NEU
7403984179597151493,2024-12-02 22:25:31.465310,Ricardo,https://www.tiktok.com/@ricardo877chl,ya está seca la ropa,8-21,1,obsidian,tiktok,NEG
7403984179597151493,2024-12-02 22:25:31.474308,Abel Baronovich,https://www.tiktok.com/@abelbaron,"Nada nuevo, Tony Buzan ya lo digo hace décadas en sus publicaciones sobre MAPAS MENTALES.",8-27,0,obsidian,tiktok,NEU
7407930608619474208,2024-12-02 22:26:20.899081,Angel M. L.,https://www.tiktok.com/@angelm.l7,Has probado appflowy?? Creo que es una alternativa interesante a ambos,8-27,2,obsidian,tiktok,POS
7407930608619474208,2024-12-02 22:26:20.910080,El Vitas,https://www.tiktok.com/@elvitas20,Prefiero obsidian para apuntes. Tener algo muy complejo para apuntes hace que termines gastando más tiempo en tener tus apuntes que en aprender,11-8,2,obsidian,tiktok,NEG
7407930608619474208,2024-12-02 22:26:20.919084,Alberto Viedas,https://www.tiktok.com/@albertoviedas,No me he decidido por OBDISIDIAN porque no se pueden hacer bases de datos relacionadas como en NOTION,Hace 5 día(s),0,obsidian,tiktok,NEG
7407930608619474208,2024-12-02 22:26:20.929080,economyc0der,https://www.tiktok.com/@economyc0der,probaré obsidian,9-25,0,obsidian,tiktok,NEU
7407930608619474208,2024-12-02 22:26:20.942080,Ramir Fortes,https://www.tiktok.com/@rfortes7,"Yo he pasado por ambos, primero Notion, luego Obsidian. Y ahora acabo de volver a Notion",8-27,11,obsidian,tiktok,NEU
7407930608619474208,2024-12-02 22:26:20.951169,Xpark,https://www.tiktok.com/@xpark_343,"ando probando Anytype, sigue en beta pero parece prometedor, guarda archivos en local que luego puedes sincronizar en la nube si quieres, tiene la organización de Obsidian y la interfaz de Notion",9-12,1,obsidian,tiktok,POS
7407930608619474208,2024-12-02 22:26:20.961169,victorss,https://www.tiktok.com/@viixtoor18,Notion me parece que tiene muchas más herramientas,8-27,1,obsidian,tiktok,POS
7407930608619474208,2024-12-02 22:26:20.969169,Marc,https://www.tiktok.com/@marcg384,"Las dos también, obsidian para la parte creativa y de conocimiento",8-27,0,obsidian,tiktok,NEU
7407930608619474208,2024-12-02 22:26:20.979167,adrian.lxrd,https://www.tiktok.com/@petherparkher6,"estoy estudiando te de ingeniería en software y uso dos, Obsidian para notas y Notion para administrarme",8-27,8,obsidian,tiktok,NEU
7407930608619474208,2024-12-02 22:26:20.989169,Cristian Leon,https://www.tiktok.com/@cristianleon09,"Me he comprado hace poco un macbook y no se si ponerle la carcasa porque algunos dicen que deforma la pantalla, tú que opinas sobre esto y cual es tu experiencia.",8-31,0,obsidian,tiktok,NEG
7407930608619474208,2024-12-02 22:26:20.998167,Daniel Mattos,https://www.tiktok.com/@seniordelbug,"Obsidean, puedes integrarlo a diferentes pluggins como PDF, excalidraw, sql, BPMN, DOT, y otros. obsidean es más fluido. Lo sincronizo con Mega o Google drive.",9-1,0,obsidian,tiktok,NEU
7407930608619474208,2024-12-02 22:26:21.007167,frnperez_,https://www.tiktok.com/@frnperez_,Holaa ultimamente estoy viendo muchos videos asi y era por si me podeis explicar q son y para q sirven,8-27,0,obsidian,tiktok,NEU
7407930608619474208,2024-12-02 22:26:21.015169,Isa,https://www.tiktok.com/@isaqqqk,Emacs 😎,8-29,0,obsidian,tiktok,POS
7407930608619474208,2024-12-02 22:26:21.024168,Pablo,https://www.tiktok.com/@pablo_03_cg,jira software,8-27,0,obsidian,tiktok,NEU
7407930608619474208,2024-12-02 22:26:21.033190,salvadordaz1,https://www.tiktok.com/@salvadordaz1,"Obsidian es para el aprendizaje
One Note es para la planificación
Notio es para la basura
😎 lloren",8-29,1,obsidian,tiktok,NEG
